{
    "schema_version": "1.0",
    "tables": [
        {
            "name": "CUST",
            "namespace": "RAW",
            "columns": [
                {
                    "name": "CUST_ID"
                },
                {
                    "name": "FIRST_NAME"
                },
                {
                    "name": "LAST_NAME"
                },
                {
                    "name": "BIRTH_DT"
                },
                {
                    "name": "ORG_FLAG"
                },
                {
                    "name": "TAX_ID"
                }
            ]
        },
        {
            "name": "PARTY",
            "namespace": "INS",
            "columns": [
                {
                    "name": "PARTY_NAME",
                    "data_type": "CHAR"
                },
                {
                    "name": "PARTY_TYPE",
                    "data_type": "CHAR"
                },
                {
                    "name": "PARTY_ID"
                },
                {
                    "name": "DATE_OF_BIRTH"
                },
                {
                    "name": "TAX_IDENTIFIER"
                }
            ]
        },
        {
            "name": "POL",
            "namespace": "RAW",
            "columns": [
                {
                    "name": "POL_SK"
                },
                {
                    "name": "POL_NO"
                },
                {
                    "name": "INSURED_ID"
                },
                {
                    "name": "EFF_DT"
                },
                {
                    "name": "EXP_DT"
                },
                {
                    "name": "WP_AMT"
                },
                {
                    "name": "STATUS_CD"
                }
            ]
        },
        {
            "name": "POLICY",
            "namespace": "INS",
            "columns": [
                {
                    "name": "POLICY_ID"
                },
                {
                    "name": "POLICY_NUMBER"
                },
                {
                    "name": "CUST_ID"
                },
                {
                    "name": "CUSTOMER_ID"
                },
                {
                    "name": "EFFECTIVE_DATE"
                },
                {
                    "name": "EXPIRATION_DATE"
                },
                {
                    "name": "TERM_MONTHS"
                },
                {
                    "name": "WRITTEN_PREMIUM"
                },
                {
                    "name": "POLICY_STATUS",
                    "data_type": "CHAR"
                }
            ]
        },
        {
            "name": "COV",
            "namespace": "RAW",
            "columns": [
                {
                    "name": "COV_SK"
                },
                {
                    "name": "POL_SK"
                },
                {
                    "name": "COV_CODE"
                },
                {
                    "name": "LIMIT_AMT"
                },
                {
                    "name": "DEDUCTIBLE_AMT"
                },
                {
                    "name": "BASE_PREM"
                },
                {
                    "name": "RATING_FACTOR"
                }
            ]
        },
        {
            "name": "COVERAGE",
            "namespace": "INS",
            "columns": [
                {
                    "name": "COVERAGE_ID"
                },
                {
                    "name": "POLICY_ID"
                },
                {
                    "name": "COVERAGE_CODE"
                },
                {
                    "name": "LIMIT_AMOUNT"
                },
                {
                    "name": "DEDUCTIBLE_AMOUNT"
                },
                {
                    "name": "COVERAGE_PREMIUM"
                }
            ]
        },
        {
            "name": "LOC",
            "namespace": "RAW",
            "columns": [
                {
                    "name": "LOC_SK"
                },
                {
                    "name": "POL_SK"
                },
                {
                    "name": "ADDR1"
                },
                {
                    "name": "CITY"
                },
                {
                    "name": "STATE_CD"
                },
                {
                    "name": "ZIP"
                },
                {
                    "name": "CONSTR_TYPE"
                },
                {
                    "name": "YR_BUILT"
                },
                {
                    "name": "TIV_AMT"
                }
            ]
        },
        {
            "name": "INSURED_LOCATION",
            "namespace": "INS",
            "columns": [
                {
                    "name": "LOCATION_ID"
                },
                {
                    "name": "POLICY_ID"
                },
                {
                    "name": "ADDRESS_LINE1"
                },
                {
                    "name": "CITY"
                },
                {
                    "name": "STATE"
                },
                {
                    "name": "POSTAL_CODE"
                },
                {
                    "name": "CONSTRUCTION_TYPE"
                },
                {
                    "name": "YEAR_BUILT"
                },
                {
                    "name": "TIV"
                }
            ]
        },
        {
            "name": "CLM",
            "namespace": "RAW",
            "columns": [
                {
                    "name": "CLM_SK"
                },
                {
                    "name": "CLM_NO"
                },
                {
                    "name": "POL_SK"
                },
                {
                    "name": "COV_SK"
                },
                {
                    "name": "ADJUSTER_ID"
                },
                {
                    "name": "LOSS_DT"
                },
                {
                    "name": "RPT_DT"
                },
                {
                    "name": "CLM_STATUS"
                },
                {
                    "name": "PERIL_DESC"
                },
                {
                    "name": "CASE_RESERVE"
                }
            ]
        },
        {
            "name": "CLAIM_STAGE",
            "columns": [
                {
                    "name": "CLAIM_ID"
                },
                {
                    "name": "CLAIM_NUMBER"
                },
                {
                    "name": "POLICY_ID"
                },
                {
                    "name": "COVERAGE_ID"
                },
                {
                    "name": "ADJUSTER_ID"
                },
                {
                    "name": "LOSS_DATE"
                },
                {
                    "name": "REPORT_DATE"
                },
                {
                    "name": "CLAIM_STATUS",
                    "data_type": "CHAR"
                },
                {
                    "name": "CAUSE_OF_LOSS"
                },
                {
                    "name": "RESERVE_AMOUNT"
                }
            ]
        },
        {
            "name": "ADJ",
            "namespace": "RAW",
            "columns": [
                {
                    "name": "ADJUSTER_ID"
                },
                {
                    "name": "ADJUSTER_NAME"
                }
            ]
        },
        {
            "name": "CLAIM",
            "namespace": "INS",
            "columns": [
                {
                    "name": "CLAIM_ID"
                },
                {
                    "name": "CLAIM_NUMBER"
                },
                {
                    "name": "POLICY_ID"
                },
                {
                    "name": "COVERAGE_ID"
                },
                {
                    "name": "LOSS_DATE"
                },
                {
                    "name": "REPORT_DATE"
                },
                {
                    "name": "CLAIM_STATUS"
                },
                {
                    "name": "CAUSE_OF_LOSS"
                },
                {
                    "name": "RESERVE_AMOUNT"
                },
                {
                    "name": "ADJUSTER_NAME"
                }
            ]
        },
        {
            "name": "PAY",
            "namespace": "RAW",
            "columns": [
                {
                    "name": "PAY_SK"
                },
                {
                    "name": "CLM_SK"
                },
                {
                    "name": "PAY_TYPE"
                },
                {
                    "name": "PAY_DT"
                },
                {
                    "name": "PAY_AMT"
                },
                {
                    "name": "RSV_DELTA"
                }
            ]
        },
        {
            "name": "CLAIM_TRANSACTION",
            "namespace": "INS",
            "columns": [
                {
                    "name": "CLAIM_TXN_ID"
                },
                {
                    "name": "CLAIM_ID"
                },
                {
                    "name": "TXN_TYPE"
                },
                {
                    "name": "TXN_DATE"
                },
                {
                    "name": "PAID_AMOUNT"
                },
                {
                    "name": "RESERVE_CHANGE"
                }
            ]
        },
        {
            "name": "POLICY_PREMIUM_SUMMARY",
            "namespace": "MART",
            "columns": [
                {
                    "name": "POLICY_ID"
                },
                {